<?xml version="1.0"?>
<!DOCTYPE Report
[
<!ELEMENT Report (General ,(Doc|BPT)) >
<!ATTLIST Report ver CDATA #REQUIRED tmZone CDATA #REQUIRED>

<!ELEMENT General ( DocLocation ) >
<!ATTLIST General productName CDATA #REQUIRED productVer CDATA #REQUIRED os CDATA #REQUIRED host CDATA #REQUIRED qcserver CDATA #IMPLIED qcproject CDATA #IMPLIED SolManSolutionId CDATA #IMPLIED SolManProjectId CDATA #IMPLIED SolManTestPlanId CDATA #IMPLIED SolManTestPackageId CDATA #IMPLIED SolManUserInfoData CDATA #IMPLIED  >

<!ELEMENT BPT (DName,Res,DVer?,TSet?,TInst?,NodeArgs,AdditionalInfo*,Doc*) >
<!ATTLIST BPT rID ID #REQUIRED >

<!ELEMENT Doc (DName,ConfName?,Res,DVer?,TSet?,TInst?,RunType?,DT?,AdditionalInfo*,Step*,DIter*,Step*,Action*,Doc*,Summary?,TestMaintenanceSummary*,NodeArgs?) >
<!ATTLIST Doc rID ID #REQUIRED type (Test|BC|BPTWrapperTest|Flow|Group|Action) "Test" productName CDATA #REQUIRED BCIter CDATA #IMPLIED >

<!ELEMENT RunType ( #PCDATA )>
<!ATTLIST RunType fmStep (False|True) "False" batch (False|True) "False" upDesc (False|True) "False" upChk (False|True) "False" upAS (False|True) "False">

<!ELEMENT DName ( #PCDATA ) >

<!ELEMENT ConfName ( #PCDATA ) >

<!ELEMENT Res ( #PCDATA ) >

<!ELEMENT AdditionalInfo (AdditionalDataName,AdditionalDataValue ) >

<!ELEMENT AdditionalDataName ( #PCDATA ) >

<!ELEMENT AdditionalDataValue ( #PCDATA ) >

<!ELEMENT DVer ( #PCDATA ) >

<!ELEMENT TSet ( #PCDATA ) >

<!ELEMENT TInst ( #PCDATA ) >

<!ELEMENT DIter (Step*,Action+,Summary?,NodeArgs)>
<!ATTLIST DIter rID ID #REQUIRED iterID CDATA #REQUIRED>

<!ELEMENT DocLocation ( #PCDATA )>

<!ELEMENT Action (AName,AIter*,(Step|HtmlStep|Action)*, Summary,ActionMaintenanceSummary*, NodeArgs ) >
<!ATTLIST Action rID ID #REQUIRED>

<!ELEMENT AIter ((Step|HtmlStep|Action)*,DataMapping?, Summary?,NodeArgs) >
<!ATTLIST AIter rID ID #REQUIRED iterID CDATA #REQUIRED isCountable (False|True) "False" >

<!ELEMENT AName ( #PCDATA ) >

<!ELEMENT TestMaintenanceSummary (ActionMaintenanceSummary*) >
<!ATTLIST TestMaintenanceSummary ObjectsAdded CDATA #REQUIRED ObjectsUpdated CDATA #REQUIRED StepsUpdated CDATA #REQUIRED StepsComments CDATA #REQUIRED><!ELEMENT ActionMaintenanceSummary (ObjectChange* ) >
<!ATTLIST ActionMaintenanceSummary Action CDATA #REQUIRED Objects CDATA #REQUIRED Updated CDATA #REQUIRED LinesTotal CDATA #REQUIRED Added CDATA #REQUIRED LinesUpdated CDATA #REQUIRED>

<!ELEMENT ObjectChange  (Hierarchy, PropertyChangeList* ) >
<!ATTLIST ObjectChange Operation CDATA #IMPLIED OriginalRepository CDATA #IMPLIED>

<!ELEMENT PropertyChangeList (PropertyDef*) >

<!ELEMENT PropertyDef (OriginalValue, NewValue) >
<!ATTLIST PropertyDef PropName CDATA #REQUIRED OriginRegularExpression (True|False) "False" NewRegularExpression (True|False) "False" AddedProperty (True|False) "False" >

<!ELEMENT OriginalValue ( #PCDATA )>

<!ELEMENT NewValue ( #PCDATA )>

<!ELEMENT Hierarchy  (ObjectName, Hierarchy*) >
<!ATTLIST Hierarchy MicClass CDATA #REQUIRED>

<!ELEMENT ObjectName  ( #PCDATA ) >

<!ELEMENT Step (Obj,Details,Time,TimeTick* ,(Step|HtmlStep|Doc)*, DataMapping?, NodeArgs) >
<!ATTLIST Step rID ID #REQUIRED retval CDATA #IMPLIED>

<!ELEMENT HtmlStep (HTML,TimeTick*,(Step|HtmlStep|Doc)*,NodeArgs) >
<!ATTLIST HtmlStep rID ID #REQUIRED >

<!ELEMENT Obj ( #PCDATA ) >
<!ATTLIST Obj plainTxt (False|True) "True">

<!ELEMENT Details ( #PCDATA ) >
<!ATTLIST Details plainTxt (False|True) "True">

<!ELEMENT Time ( #PCDATA ) >

<!ELEMENT HTML ( #PCDATA ) >

<!ELEMENT Disp ( #PCDATA ) >

<!ELEMENT TimeTick ( #PCDATA ) >

<!ELEMENT DataMapping ( DataMappedItem* )>
<!ELEMENT DataMappedItem EMPTY >
<!ATTLIST DataMappedItem dsName CDATA #REQUIRED >
<!ATTLIST DataMappedItem rowId CDATA #REQUIRED >

<!ELEMENT NodeArgs (Disp,TopPane?,BtmPane?,ExtendedInfo? )>
<!ATTLIST NodeArgs eType CDATA #REQUIRED icon CDATA #REQUIRED nRep CDATA #REQUIRED UserNote CDATA #IMPLIED filter (False|True) "True">
<!ATTLIST NodeArgs status (Passed|Failed|Done|Warning|Information) "Done">
<!ATTLIST NodeArgs iconSel CDATA #IMPLIED nType CDATA #IMPLIED MovieMarker CDATA "">
<!ATTLIST NodeArgs Source CDATA #IMPLIED SourceLine CDATA #IMPLIED StepFlowItemKey CDATA #IMPLIED >

<!ELEMENT TopPane (Path)>

<!ELEMENT BtmPane ( (Path|WR)?,ASHilite?)>
<!ATTLIST BtmPane vType CDATA "HTML">

<!ELEMENT Path ( #PCDATA ) >

<!ELEMENT ASHilite ( #PCDATA ) >

<!ELEMENT WR ( #PCDATA ) >

<!ELEMENT ExtendedInfo ( StepData ) >

<!ATTLIST ExtendedInfo StepType CDATA #REQUIRED>
<!ELEMENT DT (NodeArgs) >
<!ATTLIST DT rID ID #REQUIRED>

<!ELEMENT Summary (Param*)>
<!ATTLIST Summary sTime CDATA #IMPLIED eTime CDATA #IMPLIED passed CDATA #IMPLIED failed CDATA #IMPLIED warnings CDATA #IMPLIED retval CDATA #IMPLIED stopped (False|True) "False" >

<!ELEMENT Param (ParamName,ParamVal)+ >
<!ATTLIST Param paramInOut (In|Out) "In">

<!ELEMENT ParamName ( #PCDATA ) >

<!ELEMENT ParamVal ( #PCDATA ) >

]
>
<Report ver="2.0" tmZone="India Standard Time">
<General productName="Micro Focus Unified Functional Testing" productVer="14.50" os="" host="INLEN8520024624"><DocLocation><![CDATA[C:\Payback\Payback_Project]]></DocLocation></General>
<Doc rID="T1"   productName= "Micro Focus Unified Functional Testing"  >
<DName><![CDATA[Payback_Project]]></DName>
<Res><![CDATA[Res160]]></Res>
<DT rID="T2">
<NodeArgs eType="Table" icon="2" nRep="4" filter="False" >
<Disp><![CDATA[Run-Time Data Table]]></Disp>
<BtmPane vType="Table" >
<Path><![CDATA[Default.xls]]></Path>
</BtmPane>
</NodeArgs>
</DT>
<DIter rID="T3" iterID="1" >
<Step rID="T4">
<Obj plainTxt="False" ><![CDATA[StartUp Browser]]></Obj>
<Details plainTxt="False" ><![CDATA[<table><tr><td><span style="text-align : left; font-size : 12px; ">Local Browser</span></td></tr></table>]]></Details>
<Time><![CDATA[07-09-2023 - 15:59:03]]></Time>
<TimeTick>1694082543</TimeTick>
<Step rID="T5">
<Obj plainTxt="False" ><![CDATA[StartUp Browser.Navigate]]></Obj>
<Details plainTxt="False" ><![CDATA[Navigate to https://www.payback.in/]]></Details>
<Time><![CDATA[07-09-2023 - 15:59:03]]></Time>
<TimeTick>1694082543</TimeTick>
<NodeArgs eType="Replay" icon="4" nRep="9" Source="Action0" SourceLine="-1" >
<Disp><![CDATA[StartUp Browser.Navigate]]></Disp>
</NodeArgs>
</Step>
<Step rID="T6">
<Obj plainTxt="False" ><![CDATA[StartUp Browser.Sync]]></Obj>
<Details plainTxt="False" ><![CDATA[]]></Details>
<Time><![CDATA[07-09-2023 - 15:59:07]]></Time>
<TimeTick>1694082547</TimeTick>
<NodeArgs eType="Replay" icon="4" nRep="11" Source="Action0" SourceLine="-1" >
<Disp><![CDATA[StartUp Browser.Sync]]></Disp>
</NodeArgs>
</Step>
<NodeArgs eType="Context" icon="4" nRep="8" Source="Action0" SourceLine="-1" >
<Disp><![CDATA[StartUp Browser]]></Disp>
</NodeArgs>
</Step>
<Action rID="T7">
<AName><![CDATA[Login]]></AName>
<Step rID="T8">
<Obj plainTxt="False" ><![CDATA[Zillion - aha, everywhere!]]></Obj>
<Details plainTxt="False" ><![CDATA[<table><tr><td><span style="text-align : left; font-size : 12px; ">Local Browser</span></td></tr></table>]]></Details>
<Time><![CDATA[07-09-2023 - 15:59:07]]></Time>
<TimeTick>1694082547</TimeTick>
<Step rID="T9">
<Obj plainTxt="False" ><![CDATA[Zillion - aha, everywhere!]]></Obj>
<Details plainTxt="False" ><![CDATA[Page]]></Details>
<Time><![CDATA[07-09-2023 - 15:59:07]]></Time>
<TimeTick>1694082547</TimeTick>
<Step rID="T10">
<Obj plainTxt="False" ><![CDATA[LOGIN / SIGNUP.Exist]]></Obj>
<Details plainTxt="False" ><![CDATA["Object exists"]]></Details>
<Time><![CDATA[07-09-2023 - 15:59:07]]></Time>
<TimeTick>1694082547</TimeTick>
<NodeArgs eType="Replay" icon="7" nRep="16" >
<Disp><![CDATA[LOGIN / SIGNUP.Exist]]></Disp>
</NodeArgs>
</Step>
<NodeArgs eType="Context" icon="6" nRep="15" >
<Disp><![CDATA[Zillion - aha, everywhere!]]></Disp>
</NodeArgs>
</Step>
<NodeArgs eType="Context" icon="4" nRep="14" >
<Disp><![CDATA[Zillion - aha, everywhere!]]></Disp>
</NodeArgs>
</Step>
<Step rID="T11">
<Obj ><![CDATA[Login successfully]]></Obj>
<Details ><![CDATA[PASSED]]></Details>
<Time><![CDATA[07-09-2023 - 15:59:07]]></Time>
<TimeTick>1694082547</TimeTick>
<NodeArgs eType="User" icon="8" nRep="17" status="Passed" >
<Disp><![CDATA[Login successfully]]></Disp>
</NodeArgs>
</Step>
<Step rID="T12">
<Obj plainTxt="False" ><![CDATA[Zillion - aha, everywhere!]]></Obj>
<Details plainTxt="False" ><![CDATA[<table><tr><td><span style="text-align : left; font-size : 12px; ">Local Browser</span></td></tr></table>]]></Details>
<Time><![CDATA[07-09-2023 - 15:59:07]]></Time>
<TimeTick>1694082547</TimeTick>
<Step rID="T13">
<Obj plainTxt="False" ><![CDATA[Zillion - aha, everywhere!]]></Obj>
<Details plainTxt="False" ><![CDATA[Page]]></Details>
<Time><![CDATA[07-09-2023 - 15:59:07]]></Time>
<TimeTick>1694082547</TimeTick>
<Step rID="T14">
<Obj plainTxt="False" ><![CDATA[LOGIN / SIGNUP.Click]]></Obj>
<Details plainTxt="False" ><![CDATA[]]></Details>
<Time><![CDATA[07-09-2023 - 15:59:07]]></Time>
<TimeTick>1694082547</TimeTick>
<NodeArgs eType="Replay" icon="7" nRep="22" >
<Disp><![CDATA[LOGIN / SIGNUP.Click]]></Disp>
</NodeArgs>
</Step>
<NodeArgs eType="Context" icon="6" nRep="21" >
<Disp><![CDATA[Zillion - aha, everywhere!]]></Disp>
</NodeArgs>
</Step>
<Step rID="T15">
<Obj plainTxt="False" ><![CDATA[Zillion - aha, everywhere!_2]]></Obj>
<Details plainTxt="False" ><![CDATA[Page]]></Details>
<Time><![CDATA[07-09-2023 - 15:59:07]]></Time>
<TimeTick>1694082547</TimeTick>
<Step rID="T16">
<Obj plainTxt="False" ><![CDATA[WebNumber.Set]]></Obj>
<Details plainTxt="False" ><![CDATA["9164799194"]]></Details>
<Time><![CDATA[07-09-2023 - 15:59:07]]></Time>
<TimeTick>1694082547</TimeTick>
<NodeArgs eType="Replay" icon="9" nRep="26" >
<Disp><![CDATA[WebNumber.Set]]></Disp>
</NodeArgs>
</Step>
<Step rID="T17">
<Obj plainTxt="False" ><![CDATA[CONTINUE.Click]]></Obj>
<Details plainTxt="False" ><![CDATA[]]></Details>
<Time><![CDATA[07-09-2023 - 15:59:07]]></Time>
<TimeTick>1694082547</TimeTick>
<NodeArgs eType="Replay" icon="7" nRep="29" >
<Disp><![CDATA[CONTINUE.Click]]></Disp>
</NodeArgs>
</Step>
<Step rID="T18">
<Obj plainTxt="False" ><![CDATA[CONTINUE.Click]]></Obj>
<Details plainTxt="False" ><![CDATA[]]></Details>
<Time><![CDATA[07-09-2023 - 15:59:22]]></Time>
<TimeTick>1694082562</TimeTick>
<NodeArgs eType="Replay" icon="7" nRep="32" >
<Disp><![CDATA[CONTINUE.Click]]></Disp>
</NodeArgs>
</Step>
<NodeArgs eType="Context" icon="6" nRep="25" >
<Disp><![CDATA[Zillion - aha, everywhere!_2]]></Disp>
</NodeArgs>
</Step>
<NodeArgs eType="Context" icon="4" nRep="20" >
<Disp><![CDATA[Zillion - aha, everywhere!]]></Disp>
</NodeArgs>
</Step>
<Step rID="T19">
<Obj ><![CDATA[Login successfully]]></Obj>
<Details ><![CDATA[PASSED]]></Details>
<Time><![CDATA[07-09-2023 - 15:59:22]]></Time>
<TimeTick>1694082562</TimeTick>
<NodeArgs eType="User" icon="8" nRep="33" status="Passed" >
<Disp><![CDATA[Login successfully]]></Disp>
</NodeArgs>
</Step>
<Step rID="T20">
<Obj plainTxt="False" ><![CDATA[Zillion - aha, everywhere!_2]]></Obj>
<Details plainTxt="False" ><![CDATA[<table><tr><td><span style="text-align : left; font-size : 12px; ">Local Browser</span></td></tr></table>]]></Details>
<Time><![CDATA[07-09-2023 - 15:59:43]]></Time>
<TimeTick>1694082583</TimeTick>
<Step rID="T21">
<Obj plainTxt="False" ><![CDATA[Zillion - aha, everywhere!]]></Obj>
<Details plainTxt="False" ><![CDATA[Page]]></Details>
<Time><![CDATA[07-09-2023 - 15:59:43]]></Time>
<TimeTick>1694082583</TimeTick>
<Step rID="T22">
<Obj plainTxt="False" ><![CDATA[WebElement.Exist]]></Obj>
<Details plainTxt="False" ><![CDATA["Object does not exist"]]></Details>
<Time><![CDATA[07-09-2023 - 15:59:43]]></Time>
<TimeTick>1694082583</TimeTick>
<NodeArgs eType="Replay" icon="10" nRep="184" >
<Disp><![CDATA[WebElement.Exist]]></Disp>
</NodeArgs>
</Step>
<NodeArgs eType="Context" icon="6" nRep="183" >
<Disp><![CDATA[Zillion - aha, everywhere!]]></Disp>
</NodeArgs>
</Step>
<NodeArgs eType="Context" icon="4" nRep="182" >
<Disp><![CDATA[Zillion - aha, everywhere!_2]]></Disp>
</NodeArgs>
</Step>
<Step rID="T23">
<Obj ><![CDATA[Ledger is not working]]></Obj>
<Details ><![CDATA[FAILED]]></Details>
<Time><![CDATA[07-09-2023 - 15:59:43]]></Time>
<TimeTick>1694082583</TimeTick>
<NodeArgs eType="User" icon="8" nRep="185" status="Failed" >
<Disp><![CDATA[Ledger is not working]]></Disp>
</NodeArgs>
</Step>
<Step rID="T24">
<Obj plainTxt="False" ><![CDATA[Zillion - aha, everywhere!_2]]></Obj>
<Details plainTxt="False" ><![CDATA[<table><tr><td><span style="text-align : left; font-size : 12px; ">Local Browser</span></td></tr></table>]]></Details>
<Time><![CDATA[07-09-2023 - 16:00:03]]></Time>
<TimeTick>1694082603</TimeTick>
<Step rID="T25">
<Obj plainTxt="False" ><![CDATA[Profile | Zillion - aha,]]></Obj>
<Details plainTxt="False" ><![CDATA[Page]]></Details>
<Time><![CDATA[07-09-2023 - 16:00:03]]></Time>
<TimeTick>1694082603</TimeTick>
<Step rID="T26">
<Obj plainTxt="False" ><![CDATA[Your Orders.Exist]]></Obj>
<Details plainTxt="False" ><![CDATA["Object does not exist"]]></Details>
<Time><![CDATA[07-09-2023 - 16:00:03]]></Time>
<TimeTick>1694082603</TimeTick>
<NodeArgs eType="Replay" icon="10" nRep="338" >
<Disp><![CDATA[Your Orders.Exist]]></Disp>
</NodeArgs>
</Step>
<NodeArgs eType="Context" icon="6" nRep="337" >
<Disp><![CDATA[Profile | Zillion - aha,]]></Disp>
</NodeArgs>
</Step>
<NodeArgs eType="Context" icon="4" nRep="336" >
<Disp><![CDATA[Zillion - aha, everywhere!_2]]></Disp>
</NodeArgs>
</Step>
<Step rID="T27">
<Obj ><![CDATA[Orders not found]]></Obj>
<Details ><![CDATA[FAILED]]></Details>
<Time><![CDATA[07-09-2023 - 16:00:03]]></Time>
<TimeTick>1694082603</TimeTick>
<NodeArgs eType="User" icon="8" nRep="339" status="Failed" >
<Disp><![CDATA[Orders not found]]></Disp>
</NodeArgs>
</Step>
<Step rID="T28">
<Obj plainTxt="False" ><![CDATA[Zillion - aha, everywhere!_2]]></Obj>
<Details plainTxt="False" ><![CDATA[<table><tr><td><span style="text-align : left; font-size : 12px; ">Local Browser</span></td></tr></table>]]></Details>
<Time><![CDATA[07-09-2023 - 16:00:03]]></Time>
<TimeTick>1694082603</TimeTick>
<Step rID="T29">
<Obj plainTxt="False" ><![CDATA[Profile | Zillion - aha,]]></Obj>
<Details plainTxt="False" ><![CDATA[Page]]></Details>
<Time><![CDATA[07-09-2023 - 16:00:03]]></Time>
<TimeTick>1694082603</TimeTick>
<Step rID="T30">
<Obj plainTxt="False" ><![CDATA[Profile | Zillion - aha,.Exist]]></Obj>
<Details plainTxt="False" ><![CDATA["Object exists"]]></Details>
<Time><![CDATA[07-09-2023 - 16:00:03]]></Time>
<TimeTick>1694082603</TimeTick>
<NodeArgs eType="Replay" icon="6" nRep="343" >
<Disp><![CDATA[Profile | Zillion - aha,.Exist]]></Disp>
</NodeArgs>
</Step>
<NodeArgs eType="Context" icon="6" nRep="342" >
<Disp><![CDATA[Profile | Zillion - aha,]]></Disp>
</NodeArgs>
</Step>
<NodeArgs eType="Context" icon="4" nRep="341" >
<Disp><![CDATA[Zillion - aha, everywhere!_2]]></Disp>
</NodeArgs>
</Step>
<Step rID="T31">
<Obj ><![CDATA[All Found]]></Obj>
<Details ><![CDATA[PASSED]]></Details>
<Time><![CDATA[07-09-2023 - 16:00:03]]></Time>
<TimeTick>1694082603</TimeTick>
<NodeArgs eType="User" icon="8" nRep="344" status="Passed" >
<Disp><![CDATA[All Found]]></Disp>
</NodeArgs>
</Step>
<Step rID="T32">
<Obj plainTxt="False" ><![CDATA[Zillion - aha, everywhere!_2]]></Obj>
<Details plainTxt="False" ><![CDATA[<table><tr><td><span style="text-align : left; font-size : 12px; ">Local Browser</span></td></tr></table>]]></Details>
<Time><![CDATA[07-09-2023 - 16:00:03]]></Time>
<TimeTick>1694082603</TimeTick>
<Step rID="T33">
<Obj plainTxt="False" ><![CDATA[Profile | Zillion - aha,]]></Obj>
<Details plainTxt="False" ><![CDATA[Page]]></Details>
<Time><![CDATA[07-09-2023 - 16:00:03]]></Time>
<TimeTick>1694082603</TimeTick>
<Step rID="T34">
<Obj plainTxt="False" ><![CDATA[Profile | Zillion - aha,.Exist]]></Obj>
<Details plainTxt="False" ><![CDATA["Object exists"]]></Details>
<Time><![CDATA[07-09-2023 - 16:00:03]]></Time>
<TimeTick>1694082603</TimeTick>
<NodeArgs eType="Replay" icon="6" nRep="348" >
<Disp><![CDATA[Profile | Zillion - aha,.Exist]]></Disp>
</NodeArgs>
</Step>
<NodeArgs eType="Context" icon="6" nRep="347" >
<Disp><![CDATA[Profile | Zillion - aha,]]></Disp>
</NodeArgs>
</Step>
<NodeArgs eType="Context" icon="4" nRep="346" >
<Disp><![CDATA[Zillion - aha, everywhere!_2]]></Disp>
</NodeArgs>
</Step>
<Step rID="T35">
<Obj ><![CDATA[Earned Found]]></Obj>
<Details ><![CDATA[PASSED]]></Details>
<Time><![CDATA[07-09-2023 - 16:00:03]]></Time>
<TimeTick>1694082603</TimeTick>
<NodeArgs eType="User" icon="8" nRep="349" status="Passed" >
<Disp><![CDATA[Earned Found]]></Disp>
</NodeArgs>
</Step>
<Step rID="T36">
<Obj plainTxt="False" ><![CDATA[Zillion - aha, everywhere!_2]]></Obj>
<Details plainTxt="False" ><![CDATA[<table><tr><td><span style="text-align : left; font-size : 12px; ">Local Browser</span></td></tr></table>]]></Details>
<Time><![CDATA[07-09-2023 - 16:00:03]]></Time>
<TimeTick>1694082603</TimeTick>
<Step rID="T37">
<Obj plainTxt="False" ><![CDATA[Profile | Zillion - aha,]]></Obj>
<Details plainTxt="False" ><![CDATA[Page]]></Details>
<Time><![CDATA[07-09-2023 - 16:00:03]]></Time>
<TimeTick>1694082603</TimeTick>
<Step rID="T38">
<Obj plainTxt="False" ><![CDATA[Profile | Zillion - aha,.Exist]]></Obj>
<Details plainTxt="False" ><![CDATA["Object exists"]]></Details>
<Time><![CDATA[07-09-2023 - 16:00:03]]></Time>
<TimeTick>1694082603</TimeTick>
<NodeArgs eType="Replay" icon="6" nRep="353" >
<Disp><![CDATA[Profile | Zillion - aha,.Exist]]></Disp>
</NodeArgs>
</Step>
<NodeArgs eType="Context" icon="6" nRep="352" >
<Disp><![CDATA[Profile | Zillion - aha,]]></Disp>
</NodeArgs>
</Step>
<NodeArgs eType="Context" icon="4" nRep="351" >
<Disp><![CDATA[Zillion - aha, everywhere!_2]]></Disp>
</NodeArgs>
</Step>
<Step rID="T39">
<Obj ><![CDATA[Expired Found]]></Obj>
<Details ><![CDATA[PASSED]]></Details>
<Time><![CDATA[07-09-2023 - 16:00:03]]></Time>
<TimeTick>1694082603</TimeTick>
<NodeArgs eType="User" icon="8" nRep="354" status="Passed" >
<Disp><![CDATA[Expired Found]]></Disp>
</NodeArgs>
</Step>
<Step rID="T40">
<Obj plainTxt="False" ><![CDATA[Zillion - aha, everywhere!_2]]></Obj>
<Details plainTxt="False" ><![CDATA[<table><tr><td><span style="text-align : left; font-size : 12px; ">Local Browser</span></td></tr></table>]]></Details>
<Time><![CDATA[07-09-2023 - 16:00:03]]></Time>
<TimeTick>1694082603</TimeTick>
<Step rID="T41">
<Obj plainTxt="False" ><![CDATA[Profile | Zillion - aha,]]></Obj>
<Details plainTxt="False" ><![CDATA[Page]]></Details>
<Time><![CDATA[07-09-2023 - 16:00:03]]></Time>
<TimeTick>1694082603</TimeTick>
<Step rID="T42">
<Obj plainTxt="False" ><![CDATA[Profile | Zillion - aha,.Exist]]></Obj>
<Details plainTxt="False" ><![CDATA["Object exists"]]></Details>
<Time><![CDATA[07-09-2023 - 16:00:03]]></Time>
<TimeTick>1694082603</TimeTick>
<NodeArgs eType="Replay" icon="6" nRep="358" >
<Disp><![CDATA[Profile | Zillion - aha,.Exist]]></Disp>
</NodeArgs>
</Step>
<NodeArgs eType="Context" icon="6" nRep="357" >
<Disp><![CDATA[Profile | Zillion - aha,]]></Disp>
</NodeArgs>
</Step>
<NodeArgs eType="Context" icon="4" nRep="356" >
<Disp><![CDATA[Zillion - aha, everywhere!_2]]></Disp>
</NodeArgs>
</Step>
<Step rID="T43">
<Obj ><![CDATA[Redeemed Found]]></Obj>
<Details ><![CDATA[PASSED]]></Details>
<Time><![CDATA[07-09-2023 - 16:00:03]]></Time>
<TimeTick>1694082603</TimeTick>
<NodeArgs eType="User" icon="8" nRep="359" status="Passed" >
<Disp><![CDATA[Redeemed Found]]></Disp>
</NodeArgs>
</Step>
<Step rID="T44">
<Obj plainTxt="False" ><![CDATA[Zillion - aha, everywhere!_2]]></Obj>
<Details plainTxt="False" ><![CDATA[<table><tr><td><span style="text-align : left; font-size : 12px; ">Local Browser</span></td></tr></table>]]></Details>
<Time><![CDATA[07-09-2023 - 16:00:03]]></Time>
<TimeTick>1694082603</TimeTick>
<Step rID="T45">
<Obj plainTxt="False" ><![CDATA[Profile | Zillion - aha,]]></Obj>
<Details plainTxt="False" ><![CDATA[Page]]></Details>
<Time><![CDATA[07-09-2023 - 16:00:03]]></Time>
<TimeTick>1694082603</TimeTick>
<Step rID="T46">
<Obj plainTxt="False" ><![CDATA[Profile | Zillion - aha,.Exist]]></Obj>
<Details plainTxt="False" ><![CDATA["Object exists"]]></Details>
<Time><![CDATA[07-09-2023 - 16:00:03]]></Time>
<TimeTick>1694082603</TimeTick>
<NodeArgs eType="Replay" icon="6" nRep="363" >
<Disp><![CDATA[Profile | Zillion - aha,.Exist]]></Disp>
</NodeArgs>
</Step>
<NodeArgs eType="Context" icon="6" nRep="362" >
<Disp><![CDATA[Profile | Zillion - aha,]]></Disp>
</NodeArgs>
</Step>
<NodeArgs eType="Context" icon="4" nRep="361" >
<Disp><![CDATA[Zillion - aha, everywhere!_2]]></Disp>
</NodeArgs>
</Step>
<Step rID="T47">
<Obj ><![CDATA[Select Date Found]]></Obj>
<Details ><![CDATA[PASSED]]></Details>
<Time><![CDATA[07-09-2023 - 16:00:03]]></Time>
<TimeTick>1694082603</TimeTick>
<NodeArgs eType="User" icon="8" nRep="364" status="Passed" >
<Disp><![CDATA[Select Date Found]]></Disp>
</NodeArgs>
</Step>
<Step rID="T48">
<Obj plainTxt="False" ><![CDATA[Zillion - aha, everywhere!_2]]></Obj>
<Details plainTxt="False" ><![CDATA[<table><tr><td><span style="text-align : left; font-size : 12px; ">Local Browser</span></td></tr></table>]]></Details>
<Time><![CDATA[07-09-2023 - 16:00:03]]></Time>
<TimeTick>1694082603</TimeTick>
<Step rID="T49">
<Obj plainTxt="False" ><![CDATA[Profile | Zillion - aha,_2]]></Obj>
<Details plainTxt="False" ><![CDATA[Page]]></Details>
<Time><![CDATA[07-09-2023 - 16:00:03]]></Time>
<TimeTick>1694082603</TimeTick>
<Step rID="T50">
<Obj plainTxt="False" ><![CDATA[Profile | Zillion - aha,_2.Exist]]></Obj>
<Details plainTxt="False" ><![CDATA["Object exists"]]></Details>
<Time><![CDATA[07-09-2023 - 16:00:03]]></Time>
<TimeTick>1694082603</TimeTick>
<NodeArgs eType="Replay" icon="6" nRep="368" >
<Disp><![CDATA[Profile | Zillion - aha,_2.Exist]]></Disp>
</NodeArgs>
</Step>
<NodeArgs eType="Context" icon="6" nRep="367" >
<Disp><![CDATA[Profile | Zillion - aha,_2]]></Disp>
</NodeArgs>
</Step>
<NodeArgs eType="Context" icon="4" nRep="366" >
<Disp><![CDATA[Zillion - aha, everywhere!_2]]></Disp>
</NodeArgs>
</Step>
<Step rID="T51">
<Obj ><![CDATA[Orders Found]]></Obj>
<Details ><![CDATA[PASSED]]></Details>
<Time><![CDATA[07-09-2023 - 16:00:03]]></Time>
<TimeTick>1694082603</TimeTick>
<NodeArgs eType="User" icon="8" nRep="369" status="Passed" >
<Disp><![CDATA[Orders Found]]></Disp>
</NodeArgs>
</Step>
<Step rID="T52">
<Obj plainTxt="False" ><![CDATA[Zillion - aha, everywhere!_2]]></Obj>
<Details plainTxt="False" ><![CDATA[<table><tr><td><span style="text-align : left; font-size : 12px; ">Local Browser</span></td></tr></table>]]></Details>
<Time><![CDATA[07-09-2023 - 16:00:03]]></Time>
<TimeTick>1694082603</TimeTick>
<Step rID="T53">
<Obj plainTxt="False" ><![CDATA[Profile | Zillion - aha,]]></Obj>
<Details plainTxt="False" ><![CDATA[Page]]></Details>
<Time><![CDATA[07-09-2023 - 16:00:03]]></Time>
<TimeTick>1694082603</TimeTick>
<Step rID="T54">
<Obj plainTxt="False" ><![CDATA[Profile | Zillion - aha,.Exist]]></Obj>
<Details plainTxt="False" ><![CDATA["Object exists"]]></Details>
<Time><![CDATA[07-09-2023 - 16:00:03]]></Time>
<TimeTick>1694082603</TimeTick>
<NodeArgs eType="Replay" icon="6" nRep="373" >
<Disp><![CDATA[Profile | Zillion - aha,.Exist]]></Disp>
</NodeArgs>
</Step>
<NodeArgs eType="Context" icon="6" nRep="372" >
<Disp><![CDATA[Profile | Zillion - aha,]]></Disp>
</NodeArgs>
</Step>
<NodeArgs eType="Context" icon="4" nRep="371" >
<Disp><![CDATA[Zillion - aha, everywhere!_2]]></Disp>
</NodeArgs>
</Step>
<Step rID="T55">
<Obj ><![CDATA[Transactions Found]]></Obj>
<Details ><![CDATA[PASSED]]></Details>
<Time><![CDATA[07-09-2023 - 16:00:03]]></Time>
<TimeTick>1694082603</TimeTick>
<NodeArgs eType="User" icon="8" nRep="374" status="Passed" >
<Disp><![CDATA[Transactions Found]]></Disp>
</NodeArgs>
</Step>
<Step rID="T56">
<Obj plainTxt="False" ><![CDATA[Zillion - aha, everywhere!_2]]></Obj>
<Details plainTxt="False" ><![CDATA[<table><tr><td><span style="text-align : left; font-size : 12px; ">Local Browser</span></td></tr></table>]]></Details>
<Time><![CDATA[07-09-2023 - 16:00:03]]></Time>
<TimeTick>1694082603</TimeTick>
<Step rID="T57">
<Obj plainTxt="False" ><![CDATA[Profile | Zillion - aha,_2]]></Obj>
<Details plainTxt="False" ><![CDATA[Page]]></Details>
<Time><![CDATA[07-09-2023 - 16:00:03]]></Time>
<TimeTick>1694082603</TimeTick>
<Step rID="T58">
<Obj plainTxt="False" ><![CDATA[Profile | Zillion - aha,_2.Exist]]></Obj>
<Details plainTxt="False" ><![CDATA["Object exists"]]></Details>
<Time><![CDATA[07-09-2023 - 16:00:03]]></Time>
<TimeTick>1694082603</TimeTick>
<NodeArgs eType="Replay" icon="6" nRep="378" >
<Disp><![CDATA[Profile | Zillion - aha,_2.Exist]]></Disp>
</NodeArgs>
</Step>
<NodeArgs eType="Context" icon="6" nRep="377" >
<Disp><![CDATA[Profile | Zillion - aha,_2]]></Disp>
</NodeArgs>
</Step>
<NodeArgs eType="Context" icon="4" nRep="376" >
<Disp><![CDATA[Zillion - aha, everywhere!_2]]></Disp>
</NodeArgs>
</Step>
<Step rID="T59">
<Obj ><![CDATA[Orders Found]]></Obj>
<Details ><![CDATA[PASSED]]></Details>
<Time><![CDATA[07-09-2023 - 16:00:03]]></Time>
<TimeTick>1694082603</TimeTick>
<NodeArgs eType="User" icon="8" nRep="379" status="Passed" >
<Disp><![CDATA[Orders Found]]></Disp>
</NodeArgs>
</Step>
<Summary sTime="07-09-2023 - 15:59:07" eTime="07-09-2023 - 16:00:03" passed="10" failed="2" warnings="0" ></Summary>
<NodeArgs eType="StartAction" icon="5" nRep="12" status="Failed" >
<Disp><![CDATA[Login Summary]]></Disp>
</NodeArgs>
</Action>
<NodeArgs eType="StartIteration" icon="3" nRep="6" status="Failed" >
<Disp><![CDATA[Payback_Project Iteration 1 (Row 1)]]></Disp>
</NodeArgs>
</DIter>
<Summary sTime="07-09-2023 - 15:59:02" eTime="07-09-2023 - 16:00:03" passed="10" failed="2" warnings="0" ></Summary>
<NodeArgs eType="StartTest" icon="1" nRep="3" status="Failed" >
<Disp><![CDATA[Test Payback_Project Summary]]></Disp>
</NodeArgs>
</Doc>
</Report>